{
  "format": "steam-visualogue-compiled-deck",
  "locale": "en-US",
  "catalog_version": "steam-visualogue-catalog",
  "label_fingerprint": "sha256:bf3e030f7e6322e7c6aeefed8862d1600f6ea0d0a2e16e3013d261fb4ecb89b9",
  "title": "A Broad Shelf, Selective Depth",
  "mode": "thesis-led",
  "editorial_frame": {
    "guiding_question": "What does this pattern say about the way the library is lived?",
    "thesis": {
      "claim_id": "claim:thesis",
      "text": "A broad shelf becomes deep through selective returns.",
      "evidence_ids": [
        "metric:library-count",
        "metric:time-a"
      ]
    }
  },
  "pages": [
    {
      "page": 1,
      "narrative_move": "establish",
      "reader_question": "What does this pattern say about the way the library is lived?",
      "claim": {
        "claim_id": "claim:opening",
        "kind": "tension",
        "text": "The library starts wide, then finds a few deep channels.",
        "evidence_ids": [
          "metric:library-count"
        ],
        "develops": []
      },
      "reader_copy": {
        "headline": "The library starts wide, then finds a few deep channels."
      },
      "presentation": {
        "kind": "opening",
        "content": {}
      },
      "evidence_ids": [
        "metric:library-count"
      ],
      "visible_game_ids": [],
      "asset_ids": [],
      "measure_bindings": [],
      "legend_bindings": [],
      "item_bindings": [],
      "encoding_kind": "opening",
      "encoded_claims": [
        {
          "field": "presentation.content",
          "kind": "opening",
          "games": [],
          "achievements": [],
          "assets": [],
          "measures": [],
          "claim_id": "claim:opening"
        }
      ],
      "visible_identity_owner": "none",
      "developed_claim_ids": []
    },
    {
      "page": 2,
      "narrative_move": "deepen",
      "reader_question": "What does this pattern say about the way the library is lived?",
      "claim": {
        "claim_id": "claim:hero",
        "kind": "relation",
        "text": "One title becomes the first deep channel.",
        "evidence_ids": [
          "game:1"
        ],
        "develops": [
          "claim:thesis"
        ]
      },
      "reader_copy": {
        "headline": "One title becomes the first deep channel."
      },
      "presentation": {
        "kind": "hero",
        "content": {
          "subject": {
            "game_id": "game:1",
            "asset_id": "game:1:portrait",
            "display_name": "Game 1"
          }
        }
      },
      "evidence_ids": [
        "game:1"
      ],
      "visible_game_ids": [
        "game:1"
      ],
      "asset_ids": [
        "game:1:portrait"
      ],
      "measure_bindings": [],
      "legend_bindings": [],
      "item_bindings": [],
      "encoding_kind": "hero",
      "encoded_claims": [
        {
          "field": "presentation.content",
          "kind": "hero",
          "games": [
            "game:1"
          ],
          "achievements": [],
          "assets": [
            "game:1:portrait"
          ],
          "measures": [],
          "claim_id": "claim:hero"
        }
      ],
      "visible_identity_owner": "renderer",
      "developed_claim_ids": [
        "claim:thesis"
      ]
    },
    {
      "page": 3,
      "narrative_move": "quantify",
      "reader_question": "What does this pattern say about the way the library is lived?",
      "claim": {
        "claim_id": "claim:completion",
        "kind": "magnitude",
        "text": "Completion is selective, not uniform.",
        "evidence_ids": [
          "metric:completion"
        ],
        "develops": [
          "claim:hero"
        ]
      },
      "reader_copy": {
        "headline": "Completion is selective, not uniform."
      },
      "presentation": {
        "kind": "abstract-portrait",
        "content": {}
      },
      "evidence_ids": [
        "metric:completion"
      ],
      "visible_game_ids": [],
      "asset_ids": [],
      "measure_bindings": [],
      "legend_bindings": [],
      "item_bindings": [],
      "encoding_kind": "abstract-portrait",
      "encoded_claims": [
        {
          "field": "presentation.content",
          "kind": "abstract-portrait",
          "games": [],
          "achievements": [],
          "assets": [],
          "measures": [],
          "claim_id": "claim:completion"
        }
      ],
      "visible_identity_owner": "none",
      "developed_claim_ids": [
        "claim:hero"
      ]
    },
    {
      "page": 4,
      "narrative_move": "contrast",
      "reader_question": "What does this pattern say about the way the library is lived?",
      "claim": {
        "claim_id": "claim:quant",
        "kind": "contrast",
        "text": "A fourfold gap changes the route.",
        "evidence_ids": [
          "game:2",
          "game:3"
        ],
        "develops": [
          "claim:completion"
        ]
      },
      "reader_copy": {
        "headline": "A fourfold gap changes the route."
      },
      "presentation": {
        "kind": "quantitative-comparison",
        "content": {
          "shared_question": "Which title holds attention longer?",
          "shared_dimension": "time spent",
          "relationship_claim_id": "claim:quant",
          "items": [
            {
              "subject": {
                "game_id": "game:2",
                "asset_id": "game:2:portrait",
                "display_name": "Game 2"
              },
              "measure": {
                "raw_value": 480,
                "dimension": "duration",
                "canonical_unit": "minutes",
                "display_value": "8.0",
                "evidence_id": "game:2",
                "fact": "playtime_minutes",
                "format": {
                  "kind": "hours",
                  "precision": 1
                },
                "canonical_value": 480,
                "numeric_value": 480
              },
              "evidence_ids": [
                "game:2"
              ]
            },
            {
              "subject": {
                "game_id": "game:3",
                "asset_id": "game:3:portrait",
                "display_name": "Game 3"
              },
              "measure": {
                "raw_value": 120,
                "dimension": "duration",
                "canonical_unit": "minutes",
                "display_value": "2.0",
                "evidence_id": "game:3",
                "fact": "playtime_minutes",
                "format": {
                  "kind": "hours",
                  "precision": 1
                },
                "canonical_value": 120,
                "numeric_value": 120
              },
              "evidence_ids": [
                "game:3"
              ]
            }
          ]
        }
      },
      "evidence_ids": [
        "game:2",
        "game:3"
      ],
      "visible_game_ids": [
        "game:2",
        "game:3"
      ],
      "asset_ids": [
        "game:2:portrait",
        "game:3:portrait"
      ],
      "measure_bindings": [
        {
          "raw_value": 480,
          "dimension": "duration",
          "canonical_unit": "minutes",
          "display_value": "8.0",
          "evidence_id": "game:2",
          "fact": "playtime_minutes",
          "format": {
            "kind": "hours",
            "precision": 1
          },
          "canonical_value": 480,
          "numeric_value": 480
        },
        {
          "raw_value": 120,
          "dimension": "duration",
          "canonical_unit": "minutes",
          "display_value": "2.0",
          "evidence_id": "game:3",
          "fact": "playtime_minutes",
          "format": {
            "kind": "hours",
            "precision": 1
          },
          "canonical_value": 120,
          "numeric_value": 120
        }
      ],
      "legend_bindings": [],
      "item_bindings": [
        {
          "game_id": "game:2",
          "asset_id": "game:2:portrait",
          "measure": {
            "raw_value": 480,
            "dimension": "duration",
            "canonical_unit": "minutes",
            "display_value": "8.0",
            "evidence_id": "game:2",
            "fact": "playtime_minutes",
            "format": {
              "kind": "hours",
              "precision": 1
            },
            "canonical_value": 480,
            "numeric_value": 480
          }
        },
        {
          "game_id": "game:3",
          "asset_id": "game:3:portrait",
          "measure": {
            "raw_value": 120,
            "dimension": "duration",
            "canonical_unit": "minutes",
            "display_value": "2.0",
            "evidence_id": "game:3",
            "fact": "playtime_minutes",
            "format": {
              "kind": "hours",
              "precision": 1
            },
            "canonical_value": 120,
            "numeric_value": 120
          }
        }
      ],
      "encoding_kind": "quantitative-comparison",
      "encoded_claims": [
        {
          "field": "presentation.content",
          "kind": "quantitative-comparison",
          "games": [
            "game:2",
            "game:3"
          ],
          "achievements": [],
          "assets": [
            "game:2:portrait",
            "game:3:portrait"
          ],
          "measures": [
            {
              "raw_value": 480,
              "dimension": "duration",
              "canonical_unit": "minutes",
              "display_value": "8.0",
              "evidence_id": "game:2",
              "fact": "playtime_minutes",
              "format": {
                "kind": "hours",
                "precision": 1
              },
              "canonical_value": 480,
              "numeric_value": 480
            },
            {
              "raw_value": 120,
              "dimension": "duration",
              "canonical_unit": "minutes",
              "display_value": "2.0",